{
  "$schema": "https://json-schema.org/draft/2020-12/schema",
  "$id": "https://geov0.local/simulator/scenario.schema.json",
  "title": "GEO Simulator Scenario (MVP)",
  "type": "object",
  "additionalProperties": false,
  "required": ["schema_version", "scenario_id", "participants", "trustlines"],
  "anyOf": [
    { "required": ["equivalents"] },
    { "required": ["baseEquivalent"] }
  ],
  "properties": {
    "schema_version": {
      "type": "string",
      "description": "Version of scenario.json input schema (not api_version)",
      "examples": ["scenario/1"]
    },
    "scenario_id": {
      "type": "string",
      "minLength": 1,
      "maxLength": 128,
      "pattern": "^[A-Za-z0-9](?:[A-Za-z0-9._-]{0,126}[A-Za-z0-9_-])?$",
      "description": "Also a directory name for uploaded scenarios; the backend enforces the same rule (app/core/simulator/scenario_registry.py SCENARIO_ID_PATTERN)."
    },
    "name": {
      "type": "string"
    },
    "description": {
      "description": "A plain string (older scenarios) or a {ru, en} pair. The REST detail always returns the pair; a string is returned as both languages.",
      "oneOf": [
        { "type": "string" },
        { "$ref": "#/$defs/localizedText" }
      ]
    },
    "seed": {
      "type": "integer",
      "minimum": 0,
      "description": "Optional PRNG seed for deterministic runs"
    },
    "baseEquivalent": {
      "type": "string",
      "minLength": 1,
      "description": "Optional MVP shorthand. If provided, equivalent is assumed for trustlines/events when missing. Prefer 'equivalents' for explicitness."
    },
    "equivalents": {
      "type": "array",
      "minItems": 1,
      "uniqueItems": true,
      "items": { "type": "string", "minLength": 1 }
    },
    "participants": {
      "type": "array",
      "minItems": 1,
      "items": { "$ref": "#/$defs/participant" }
    },
    "groups": {
      "type": "array",
      "items": { "$ref": "#/$defs/group" }
    },
    "behaviorProfiles": {
      "type": "array",
      "items": { "$ref": "#/$defs/behaviorProfile" }
    },
    "trustlines": {
      "type": "array",
      "minItems": 0,
      "items": { "$ref": "#/$defs/trustline" }
    },
    "events": {
      "type": "array",
      "items": { "$ref": "#/$defs/timelineEvent" }
    },
    "settings": {
      "type": "object",
      "additionalProperties": false,
      "properties": {
        "playback": {
          "type": "object",
          "additionalProperties": false,
          "description": "Pace and defaults of a run of this scenario (036). Every field is optional; an absent field keeps today's behaviour. Slice A validates and serves these fields over REST; the engine reads them in slice B, so until then they change nothing in a run.",
          "properties": {
            "tick_seconds": {
              "type": "number",
              "minimum": 0.25,
              "maximum": 5,
              "description": "Real duration of one tick, a lower bound of the period (the work of the tick comes on top). Absent = 1.0."
            },
            "intensity_percent": {
              "type": "integer",
              "minimum": 0,
              "maximum": 100,
              "description": "Default intensity of a run of this scenario."
            },
            "inject_enabled": {
              "type": "boolean",
              "description": "Opt-in of this scenario to inject events. The process flag SIMULATOR_REAL_ENABLE_INJECT stays the upper permission; a scenario without the field behaves as before (inject by the process flag)."
            }
          }
        },
        "warmup": {
          "type": "object",
          "additionalProperties": false,
          "description": "Warm-up phase configuration: the part of the run intensity above 15 % (the visitor's fast step) ramps linearly from floor to 1.0 over the first N ticks; up to 15 % runs unramped",
          "properties": {
            "ticks": {
              "type": "integer",
              "minimum": 0,
              "default": 0,
              "description": "Number of ticks for the warm-up ramp. 0 means no warm-up."
            },
            "floor": {
              "type": "number",
              "minimum": 0.0,
              "maximum": 1.0,
              "default": 0.1,
              "description": "Ramp factor at tick 0 of the intensity above 15 % (e.g. 0.1 = 10% of that excess)"
            }
          }
        },
        "trust_drift": {
          "type": "object",
          "additionalProperties": false,
          "properties": {
            "enabled": { "type": "boolean", "default": false },
            "growth_rate": {
              "type": "number",
              "minimum": 0,
              "maximum": 1,
              "default": 0.05,
              "description": "Множитель роста лимита после клиринга: new_limit = limit × (1 + growth_rate)"
            },
            "decay_rate": {
              "type": "number",
              "minimum": 0,
              "maximum": 1,
              "default": 0.02,
              "description": "Множитель уменьшения лимита при перегрузке: new_limit = limit × (1 - decay_rate)"
            },
            "max_growth": {
              "type": "number",
              "minimum": 1,
              "default": 2.0,
              "description": "Макс. кратность роста от original_limit"
            },
            "min_limit_ratio": {
              "type": "number",
              "minimum": 0,
              "maximum": 1,
              "default": 0.3,
              "description": "Мин. доля от original_limit при decay"
            },
            "overload_threshold": {
              "type": "number",
              "minimum": 0,
              "maximum": 1,
              "default": 0.8,
              "description": "Порог debt/limit для активации decay"
            }
          }
        },
        "flow": {
          "type": "object",
          "description": "Directional flow configuration: controls payment direction preferences and reciprocity",
          "additionalProperties": false,
          "properties": {
            "enabled": { "type": "boolean", "default": false },
            "default_affinity": {
              "type": "number",
              "minimum": 0,
              "maximum": 1,
              "default": 0.7,
              "description": "Default probability of following flow_chain direction (0=random, 1=always follow chain)"
            },
            "reciprocity_bonus": {
              "type": "number",
              "minimum": 0,
              "maximum": 1,
              "default": 0.15,
              "description": "Virtual reciprocity bonus as a limit multiplier: if reverse debt exists, effective limit is multiplied by (1 + reciprocity_bonus). Does not persist to DB."
            }
          }
        }
      }
    }
  },
  "$defs": {
    "id": {
      "type": "string",
      "minLength": 1,
      "maxLength": 200,
      "pattern": "^[A-Za-z0-9_.:-]+$"
    },
    "participant": {
      "type": "object",
      "additionalProperties": false,
      "required": ["id", "type"],
      "properties": {
        "id": { "$ref": "#/$defs/id" },
        "name": { "type": "string" },
        "type": { "type": "string", "enum": ["person", "business", "hub"] },
        "status": { "type": "string", "enum": ["active", "suspended", "left", "deleted", "frozen"] },
        "groupId": { "$ref": "#/$defs/id" },
        "behaviorProfileId": { "$ref": "#/$defs/id" },
        "metadata": { "type": "object", "additionalProperties": true }
      }
    },
    "group": {
      "type": "object",
      "additionalProperties": false,
      "required": ["id", "label"],
      "properties": {
        "id": { "$ref": "#/$defs/id" },
        "label": { "type": "string" }
      }
    },
    "behaviorProfile": {
      "type": "object",
      "additionalProperties": false,
      "required": ["id"],
      "properties": {
        "id": { "$ref": "#/$defs/id" },
        "extends": { "$ref": "#/$defs/id" },
        "props": {
          "type": "object",
          "additionalProperties": true,
          "description": "Profile properties. Supported keys: tx_rate (number), equivalent_weights (object), recipient_group_weights (object), amount_model (object), flow_chains (array of [fromGroupId, toGroupId] arrays — preferred payment direction chains), flow_affinity (number 0-1, default 0.7 — probability of following flow_chain), periodicity_factor (number >0, default 1.0 — multiplier for frequency: effective_rate = tx_rate / (1 + log(amount/p50) * periodicity_factor), larger amounts → less frequent)"
        },
        "rules": {
          "type": "array",
          "items": { "$ref": "#/$defs/behaviorRule" }
        }
      }
    },
    "behaviorRule": {
      "type": "object",
      "additionalProperties": false,
      "required": ["trigger", "action"],
      "properties": {
        "trigger": { "type": "string", "minLength": 1 },
        "action": { "type": "string", "minLength": 1 },
        "params": {
          "type": "object",
          "additionalProperties": true
        }
      }
    },
    "trustline": {
      "type": "object",
      "additionalProperties": false,
      "required": ["from", "to", "limit"],
      "properties": {
        "from": { "$ref": "#/$defs/id", "description": "Creditor" },
        "to": { "$ref": "#/$defs/id", "description": "Debtor" },
        "equivalent": { "type": "string" },
        "limit": {
          "$ref": "#/$defs/scenarioAmount",
          "description": "A decimal string, never a JSON number: a number would be read through a binary float (MM2-MM-B, 2026-10-31). Zero is a limit. The registry checks the same grammar where every scenario enters it (upload, stored upload, shipped fixture); storability and the equivalent's step are the seeder's named refusals."
        },
        "policy": { "type": "object", "additionalProperties": true }
      }
    },

    "timelineEvent": {
      "type": "object",
      "additionalProperties": false,
      "required": ["time", "type"],
      "properties": {
        "time": {
          "type": "integer",
          "minimum": 0,
          "description": "Event time in simulation timeline: integer milliseconds from run start. String tokens (e.g. 'day_10') are refused: the runner never understood them, so the event would silently never fire (036 F-036-1)."
        },
        "type": {
          "type": "string",
          "enum": ["payment", "clearing", "stress", "inject", "note"]
        },
        "op": {
          "type": "string",
          "description": "Operation subtype for inject events (e.g. add_participant, create_trustline, freeze_participant)"
        },
        "label": {
          "type": "string",
          "description": "Optional human-readable label for the event"
        },
        "description": { "type": "string" },
        "caption": {
          "$ref": "#/$defs/localizedText",
          "description": "What the viewer reads about this episode, in both languages (036). An event with a caption is an episode."
        },
        "pause_after": {
          "type": "boolean",
          "description": "The run pauses itself after this episode (slice B reads it)."
        },
        "focus": { "$ref": "#/$defs/episodeFocus" },
        "anchor": { "$ref": "#/$defs/episodeAnchor" },
        "expected_cycle": {
          "type": "array",
          "minItems": 2,
          "items": { "$ref": "#/$defs/id" },
          "description": "Participants of the cycle a clearing episode announces. The UI draws it only if all its edges are among those of the arriving clearing.done."
        },
        "from": { "$ref": "#/$defs/id", "description": "payment: the sender (debtor)." },
        "to": { "$ref": "#/$defs/id", "description": "payment: the receiver (creditor)." },
        "amount": {
          "$ref": "#/$defs/scenarioAmount",
          "description": "payment: a decimal string, never a number."
        },
        "equivalent": {
          "type": "string",
          "minLength": 1,
          "description": "payment / clearing: the equivalent code; absent = the scenario's default equivalent."
        },
        "effects": {
          "type": "array",
          "items": { "type": "object", "additionalProperties": true }
        },
        "metadata": { "type": "object", "additionalProperties": true }
      },
      "allOf": [
        {
          "if": {
            "properties": { "type": { "const": "payment" } },
            "required": ["type"]
          },
          "then": { "required": ["from", "to", "amount"] }
        },
        {
          "if": {
            "properties": { "type": { "const": "inject" } },
            "required": ["type"]
          },
          "then": {
            "required": ["effects"],
            "properties": {
              "effects": {
                "minItems": 1,
                "items": {
                  "oneOf": [
                    { "$ref": "#/$defs/injectEffectAddParticipant" },
                    { "$ref": "#/$defs/injectEffectCreateTrustline" },
                    { "$ref": "#/$defs/injectEffectFreezeParticipant" }
                  ]
                }
              }
            }
          }
        }
      ]
    },

    "localizedText": {
      "type": "object",
      "additionalProperties": false,
      "required": ["ru", "en"],
      "properties": {
        "ru": { "type": "string", "minLength": 1 },
        "en": { "type": "string", "minLength": 1 }
      }
    },

    "episodeFocus": {
      "type": "object",
      "additionalProperties": false,
      "description": "Where the camera and the highlight go for an episode; empty or absent = the whole graph.",
      "properties": {
        "pids": { "type": "array", "items": { "$ref": "#/$defs/id" } },
        "edges": {
          "type": "array",
          "items": {
            "type": "object",
            "additionalProperties": false,
            "required": ["from", "to"],
            "properties": {
              "from": { "$ref": "#/$defs/id" },
              "to": { "$ref": "#/$defs/id" }
            }
          }
        }
      }
    },

    "episodeAnchor": {
      "type": "object",
      "additionalProperties": false,
      "required": ["event"],
      "description": "The event whose arrival shows the episode's caption: the first not yet consumed event with these fields that arrives after the episode's time. tx.updated matches on from, to, amount, equivalent (all four required); tx.failed on from, to, equivalent (all three required, and NO amount: a failure carries none); clearing.done and topology.changed need only the event name. time_ms is the fallback for episodes that announce no action.",
      "properties": {
        "event": { "type": "string", "enum": ["tx.updated", "tx.failed", "clearing.done", "topology.changed"] },
        "from": { "$ref": "#/$defs/id" },
        "to": { "$ref": "#/$defs/id" },
        "amount": { "$ref": "#/$defs/scenarioAmount" },
        "equivalent": { "type": "string", "minLength": 1 },
        "time_ms": { "type": "integer", "minimum": 0 }
      },
      "allOf": [
        {
          "if": { "properties": { "event": { "const": "tx.updated" } }, "required": ["event"] },
          "then": { "required": ["from", "to", "amount", "equivalent"] }
        },
        {
          "if": { "properties": { "event": { "const": "tx.failed" } }, "required": ["event"] },
          "then": { "required": ["from", "to", "equivalent"], "not": { "required": ["amount"] } }
        }
      ]
    },

    "scenarioAmount": {
      "type": "string",
      "pattern": "^(?!(?:\\.?[0-9]){51})[0-9]+(?:\\.[0-9]{1,18})?(?![\\s\\S])",
      "description": "A money amount as the product's money door reads it: plain digits, at most 18 fraction digits and 50 digits in all, no sign, exponent, space or text after the last digit (`(?![\\s\\S])` is the end of the string; `$` would let a terminal newline through). Leading zeros are allowed, as everywhere. For a payment amount, upload additionally checks that the value is storable (Numeric(20, 8)) and positive; a trust line limit may be zero, and its storability and step are checked when it is seeded."
    },

    "injectEffectAddParticipant": {
      "type": "object",
      "additionalProperties": false,
      "required": ["op", "participant"],
      "properties": {
        "op": { "const": "add_participant" },
        "participant": {
          "type": "object",
          "additionalProperties": false,
          "required": ["id", "type"],
          "properties": {
            "id": { "type": "string", "minLength": 1 },
            "name": { "type": "string" },
            "type": {
              "type": "string",
              "enum": ["person", "business", "hub"]
            },
            "status": { "type": "string", "default": "active" },
            "groupId": { "type": "string" },
            "behaviorProfileId": { "type": "string" }
          }
        },
        "initial_trustlines": {
          "type": "array",
          "items": { "$ref": "#/$defs/initialTrustline" }
        }
      }
    },

    "initialTrustline": {
      "type": "object",
      "additionalProperties": false,
      "required": ["sponsor", "equivalent", "limit"],
      "properties": {
        "sponsor": {
          "type": "string",
          "minLength": 1,
          "description": "PID of the existing participant who sponsors this trustline"
        },
        "equivalent": {
          "type": "string",
          "minLength": 1,
          "description": "Equivalent code (e.g. 'HOUR', 'UAH')"
        },
        "limit": {
          "$ref": "#/$defs/scenarioAmount",
          "description": "A decimal string, never a number (MM2-MM-B, 2026-10-31). The grammar admits zero, but the inject skips a line whose limit is not positive; storability and the equivalent's step are checked when the inject runs."
        },
        "direction": {
          "type": "string",
          "enum": ["sponsor_credits_new", "new_credits_sponsor"],
          "default": "sponsor_credits_new",
          "description": "Direction of credit: sponsor_credits_new means sponsor extends credit to new participant"
        }
      }
    },

    "injectEffectCreateTrustline": {
      "type": "object",
      "additionalProperties": false,
      "required": ["op", "from", "to", "equivalent", "limit"],
      "properties": {
        "op": { "const": "create_trustline" },
        "from": {
          "type": "string",
          "minLength": 1,
          "description": "PID of the creditor"
        },
        "to": {
          "type": "string",
          "minLength": 1,
          "description": "PID of the debtor"
        },
        "equivalent": {
          "type": "string",
          "minLength": 1,
          "description": "Equivalent code (e.g. 'HOUR', 'UAH')"
        },
        "limit": {
          "$ref": "#/$defs/scenarioAmount",
          "description": "A decimal string, never a number (MM2-MM-B, 2026-10-31). The grammar admits zero, but the inject skips a line whose limit is not positive; storability and the equivalent's step are checked when the inject runs."
        }
      }
    },

    "injectEffectFreezeParticipant": {
      "type": "object",
      "additionalProperties": false,
      "required": ["op", "participant_id"],
      "properties": {
        "op": { "const": "freeze_participant" },
        "participant_id": {
          "type": "string",
          "minLength": 1,
          "description": "PID of the participant to freeze"
        },
        "freeze_trustlines": {
          "type": "boolean",
          "default": true,
          "description": "Whether to also freeze all trustlines of this participant"
        }
      }
    }
  }
}
